{
  "format": "scripture burrito",
  "meta": {
    "version": "1.0.0",
    "category": "source",
    "generator": {
      "softwareName": "Orature",
      "softwareVersion": "2.0.0",
      "userName": "Fatima Maïga"
    },
    "defaultLocale": "dje",
    "dateCreated": "2025-11-10T14:00:00+01:00"
  },
  "identification": {
    "name": {
      "en": "Zarma NT Audio — Titus",
      "dje": "Zarma Neeriya Koyra — Tit"
    },
    "abbreviation": {
      "en": "ZJNT-audio"
    }
  },
  "languages": [
    {
      "tag": "dje",
      "name": {
        "en": "Zarma",
        "dje": "Zarmaciine"
      }
    }
  ],
  "type": {
    "flavorType": {
      "name": "scripture",
      "flavor": {
        "name": "audioTranslation",
        "performance": ["singleVoice", "reading"],
        "formats": {
          "format-mp3": {
            "compression": "mp3",
            "trackConfiguration": "1/0 (Mono)",
            "bitRate": 128000,
            "samplingRate": 44100
          }
        }
      },
      "currentScope": {
        "TIT": ["1", "2", "3"]
      }
    }
  },
  "confidential": false,
  "agencies": [
    {
      "id": "https://seedcompany.com",
      "roles": ["rightsHolder", "content"],
      "url": "https://seedcompany.com",
      "name": {
        "en": "Seed Company"
      },
      "abbr": {
        "en": "SC"
      }
    }
  ],
  "ingredients": {
    "media/dje_tit_c01.mp3": {
      "checksum": {"md5": "f9bcf3872446a7d50e66c24d5692f7c7"},
      "mimeType": "audio/mpeg",
      "size": 1165070,
      "scope": {"TIT": ["1"]}
    },
    "media/dje_tit_c01.json": {
      "checksum": {"md5": "bc6e1fa1109126fb6b14e4f41bbde378"},
      "mimeType": "application/json",
      "size": 1596,
      "scope": {"TIT": ["1"]},
      "role": "timing"
    },
    "media/dje_tit_c02.mp3": {
      "checksum": {"md5": "9ee007594822f19e8e1ce6ab5d788004"},
      "mimeType": "audio/mpeg",
      "size": 933938,
      "scope": {"TIT": ["2"]}
    },
    "media/dje_tit_c02.json": {
      "checksum": {"md5": "eb5f27a17956220b848d19f0b9b6720b"},
      "mimeType": "application/json",
      "size": 1445,
      "scope": {"TIT": ["2"]},
      "role": "timing"
    },
    "media/dje_tit_c03.mp3": {
      "checksum": {"md5": "a7a8ce6c238dc260c349e12d89efbdaf"},
      "mimeType": "audio/mpeg",
      "size": 1038010,
      "scope": {"TIT": ["3"]}
    },
    "media/dje_tit_c03.json": {
      "checksum": {"md5": "3450197390f0351547be11047ba68b5e"},
      "mimeType": "application/json",
      "size": 1445,
      "scope": {"TIT": ["3"]},
      "role": "timing"
    }
  },
  "copyright": {
    "shortStatements": [
      {
        "statement": "CC BY-SA 4.0",
        "mimetype": "text/plain",
        "lang": "en"
      }
    ]
  }
}
